Review,Date Posted
I do not recommend itI do not recommend it. I bought my son a ticket for 10 journeys.  The ticket is not in the system and my son pays for subsequent tickets with his leap card.  So they took 68 euros for coffee?.  They do not respond to emails and claims.  Never ag,2023-09-25
103 route is an absolute disgrace at…103 route is an absolute disgrace at the moment.  I would give minus stars if I could!!Not sure why they have a schedule because they don't use it. Buses come and go as they please... today was another fine example of this.4.58pm  left Beresford Place at 4.48pm (It drove off as I was walking towards it) and the 5.18pm never showed up!Shocking service!,2023-08-01
"Never on timeThe  is literally NEVER on time, once waited 2 hours and it never arrived. Expensive tickets, trash inside the vehicle, not to mention the wait which you never know how much will take. Awful",2022-10-30
"Have one leap card and tried to pay for…Have one leap card and tried to pay for a trip for myself and my wife, not possible. Can't pay for the second person by card as they have an antiquated system. Passenger behind us in the queue was kind enough to pay the second fair for us.Get up to date you antiquated shower of useless f****ks",2023-04-15
"The 115 is an appalling serviceThe 115 was always bad, but it's never been so appalling this semester. You simply can not rely on it. I've completely switched to the train, into town and back.Friday, 20th of September, I was relying on the 115 to get me home from college to work. It was absolutely lashing on the quays. Loads of us waiting. The 2.00pm , and the 2.30pm , never showed up. The 3.00pm arrived at 3.20pm. I lost an hours pay of work. I was sick from being lashed on for an hour and 20 mins. That was the day I decided I will never, EVER rely on this service ever again of I have to be somewhere on time.Every now and again I try to give it a chance, but it's either up to a half an hour late, full or a ghost . It never fails to disappoint  ever.Also a word of advice, stop dispatching a single decker for the scheduled time of 9.30am in kilcock Square. It has been full every. Single. Time. The passengers ALWAYS have to wait ages for the next one.That's the only consistent thing about this , is that its consistently terrible for the exact same reason, at that time, every single morning.In short, get the train. Its amazing. If your tempted to get the 115, save yourself the misery, don't.",2023-11-16
 Éireann you really wanna sort… Éireann you really wanna sort yourselves out and start doing your job right! Getting beyond a joke at this stage. why is there certain times when the driver can’t even show up. Leaving people waiting around. Especially the elderly. Hiring staff that can’t even speak to the passengers in a nice mannerly way!! 😡 You’ve an app set up that doesn’t give people the proper time. How are we all meant to trust your service. Seriously not on. Done reporting it back when you get no where as always!! 😡,2022-08-29
  👎Ive traveled alot around the world and rarely do i come across a work force so ignorant and un professional. The way i have seen and heard the way they speak to some passangers is pathetic. Gobus and citylink are who you want to travel with.,2023-06-12
One star would-be an improvement on…One star would-be an improvement on this service.stranded yet again by   11:43 Virginia to Cavan no show May 19th 2023.,2023-05-19
"Use West Cork ConnectIncredibly unreliable. Erratic  times, which differ from the website to the signs at  stops. Bought a ticket online and the  never showed, despite arriving at the  stop for it early. Waste of time and money",2022-08-23
"bad Companybad Company. weird pricing. a ticket from Kilmacthomas to Dungarvan and then from Dungarvan to Cork costs 5 and 7 euros, a total of 12 euros. a direct ticket from Cork to Kilmacthomas costs 15 euros. Why increase the price by the same distance?",2022-08-29
"What went wrong this time?!What went wrong this time?Starting off I want to warn anyone going to an important function or planning on getting home after a long day at work to avoid the 115 to mullingar/Enfield & Kilcock.It's more of a miracle whenever it decides to show up or not be 20 minutes late. I've kept data on how many times this particular  is either extremely delayed without warning - even at its depot stop - or hasn't arrived.The ghost buses display as arriving in 4 minutes from city centre  displays but  Eireanns own real time info begs to differ. There's been countless nights in the rainy, cold, Irish elements with no updates from the company as to how their customers are going to go home.Hard working people, students and OAP are being dismissed everything a review goes up here.Unfortunately we know nothing will be done about it, more clarification as to delayed buses and frequent passenger updates would be helpful.If the country is leaning towards a greener transport vision for the population something needs to be done to combat this. Its a joke at this point.Haven't seen this issue with the 126 or 120 at the quays any time I've been standing there freezing my @$$ off after work so another can be taken from them.",2023-03-10
"L58  is NEVER ON TIMEWhenever is take the l58  it is NEVER on time and this has happened every single time I take the l58, I always end up having to wait another half an hour for the next one!",2023-06-14
"Very poor service consistently for…Very poor service consistently for years now, busses being late not arriving at all not having card machines when it states they do. Add to this very unhelpful and rude drivers I’d highly recommend travelling with a private company as   is an absolute joke.",2022-09-20
"Left In The Lurch By Customer ServiceI've been emailing  Éireann for help with a refund since July 2022. I have received only one email in response to six, in total, and remain out of pocket. I am deeply unimpressed with this service.",2022-10-26
Terrible serviceTerrible service. The 132 from Dublin to Bunclody never turned up from the city. Waiting two hours in the freezing cold for the 17:30 service. The customer care agent advised she didn't now what was going on but it would be delayed by an hour. I left the pick up point at 19:10.I'll drive from now on. I'll never leave the car behind again.,2023-02-27
"Absolute joke of a serviceAbsolute joke of a service. As many others said. Better pay off for private taxi than use it again. Not only the buses broke down on 32 route three times in the last month but are constantly late and the experience is just terrible. Avoid these aholes as wide as possible. Don't pay for it, don't allow them to make profit.",2023-03-20
"Absolute joke of a serviceAbsolute joke of a service. One  driver on the 100 sells me a ticket to Dublin airport and tells me change to to the 100x at Drogheda. The 100x drivers says the ticket is not valid and I need to buy a new ticket from scratch. Not even an “upgrade”. So what should be 11 costs 17. BTW, both buses were 10 minutes late so miraculously go there on time.",2023-03-06
Joke of a service..Joke of a service... always late and the online times never updateI've been to loads of places around Europe that have way better transportation and I can't understand why we don't!Cork City 206  is by far the worse route to try and catch a ... Terrible..,2022-08-31
"Rude driverTo be honest was thinking should i write this or no, but i decided that i will.Today on 13.04.2023 i got in a  that drives to Kells at 20:45.I have never saw such a rude driver in my life, shouting on passenger, telling him to f*** off even he just asked him why he was rude not to him (just in general) and not let another passenger inside the  after he let one lady in and that other guy was just behind her, thats a human thing to do especially if u know the next one is in one hour.He has no drivers culture , he was giving a threat  that he will stop the  and that he will refuse to drive it.If he some problems, he should get a professional help, not taking off on the passengers.We pay for this transport and we shouldn't be dealing with that kind of drivers.Hope i never see him driving this .We always have a nice and kind drivers, beside this one.Hope that this complain will get attention that is needed.",2023-04-13
"Awful serviceAwful service, you can count on it to never show up on time. Some  drivers are rude, they stop in Maynooth Glen Royal hotel station and they dont let you get of the . They only stop there to pick up new passengers and they dont allow you to get of th",2023-01-13
"My  was 50 minutes lateMy  was 50 minutes late. I politely asked if there was a possibility of a refund. The driver rudely declined and told me to gey a different  instead, missed my trip after waiting 50 minutes anyway",2022-11-23
"Why are the drivers so rude?My first experience of using the  service in Ireland and hopefully it’s not one that I have to repeat any time soon.  I’ve regularly had to rescue my young adult children from  stops and drive them to their destinations because the number 64 that didn’t turn up again, but despite this, I took the number 64 Derry to Galway  yesterday with my two teenage daughters.  My biggest complaint is the rudeness of the drivers. The first man was just miserable and gruff, but the driver that drove the return  was something else completely.  It was like being transported back to my schooldays with my ticket validity being questioned very rudely (there was nothing wrong with my ticket, he just hadn’t read it properly) and a well rounded dollop of snarkiness as I went to my seat. Just a thoroughly unpleasant, nasty man who is not suited to working with people.  At all.  The girl that I was sat next to had similar stories of rude  drivers and horrible journeys which matched all the tales that my children have brought home over the years and it makes me wonder how  Éireann run their recruitment schemes?  Buses often can’t help being late/ breaking down/ getting full etc, but can’t  Éireann at least employ drivers that can cope with the everyday annoyances of people and traffic whilst being professional, showing respect and compassion?  It’s how most reputable businesses operate after all!",2023-07-14
Waterford to Limerick route Never on…Waterford to Limerick route Never on time. Ridiculous!!! Ask the driver how much it cost with leap card? Replied:running late so don’t have time to answer… Bravo👏,2023-02-01
"This  service is a joke!This  service is a joke!! Never on time.  on the half hour do not show up or are late so they wait!! Example; 5:30  arrives at 5:38 and instead of leaving right away,  they wait till 6pm.. so you're there waiting around 45 minutes!! I don't mention Fridays!! Very unreliable!!",2023-02-28
Rubbish service.  Waited for Sligo   at Dublin Airport…Waited for Sligo   at Dublin Airport on Tuesday in freezing cold and then 1 hour late and then to make matters worse waited at Castle Baldwin for  to arrive at 3.57 on Saturday for Dublin Airport which did not come so  had to get driven to the airport so I could catch my plane.  What is going on?  Service is terrible.  I willnever travel again with them.  What a waste of money!!,2022-12-13
I was getting on the  at portlaoise…I was getting on the  at portlaoise at 10.50 on the 1st Dec and I attempted to pay with a 50 euro note. the driver would not accept it even though he had the change In his possession. I then asked could I pay with card to which he refused me and told me to f### off the  and go get change in a shop across the road. I ran over and got the change for the fare and when I came back to the  stop he drove off. He was looking at me as he was driving off. He was a bald man and was extremely rude. The treatment I received was unacceptable and its a shame someone like this is representing  . There must be other ways of payment if they refuse to take cash. Absolute joke. I am a regular user of this service and the embarrassment I experience was unforgiven. Something must be d,2022-12-01
Overcrowded  with seats so close…Overcrowded  with seats so close together that there is little room for passengers legs.Driver was helpful but seat layout was very very poor.,2022-10-01
"Buses didn't runI visit from New York every year , love just getting the  from dublin to omagh never had a problem till this may 18th 2023. I was at the  station to get the 9am  from the airport,  and no  showed ,the  11am , the 1.20  showed, at 1.40pm  but was crowed . 2pm  didn't show , the 3.pm  showed at 3.40pm. Then traveled 2. 5 hours. After being up over 24 hours and standing at a  stop with no benches,  thats not exceptional. Every other  showed up except the 32x ,there was no warning , that this  wasn't running properly,  nor did the  drivers know why these busses didn't run . A total disgrace. This will put me off from traveling next year .",2023-05-18
ClownsAbsolute clowns cannot rely on them whatsoever. They are what is wrong with public transport in this beyond backward country!,2023-05-13
"Ridiculously poor serviceRidiculously poor service. The 220X in Cork is a joke, after taking the  for years I've recently been told the 220X no longer goes to Ballincollig and now goes to MTU, got on a number of other 220X for weeks and there was no issue going to Ballincollig and it went the normal route and then on Monday me and the other passengers getting on the  were told that it does not stop on Washington St despite me getting it stopping there for years and as recently as last week.   needs competition because the monopoly they have means they continuously provide a joke of a service and don't care to respond to any enquiries",2023-06-26
"Hi,I arrived into Dublin Airport at…Hi,I arrived into Dublin Airport at 1.40 on Sunday 2nd Oct,hoping to get a  to arklow?had to wait until 6.00am,my fault for assuming there was a  every hour but was amazed by a lovely black bearded driver who could have charged me as my ticket was 6 hours out but was a real gent and signed off the ticket.He is a credit to your company and after travelling for 25 hours made our day,what a lovely man dropped us off at knockmore with a smile and a goodbye.",2022-10-02
"Service Dublin to Cork always anywhere…Service Dublin to Cork always anywhere between  30 and 60 mins late arriving at Hueston(outward journey), today I dropped my son to get the 6:11am service from Heuston(timetable on website)no  until after 8am...apparently this is the first ...unreliable serv",2022-08-16
I was getting on the 220x and i paid…I was getting on the 220x and i paid for two people. The  driver took my leap card and asked how old i was. i said i was 14 several times and i kept saying i needed it for school. And he wouldnt give it back. i had to ask multiple times for it back and after about 5 minutes of asking he gave it to me. Teach your  drivers some fuckinv respect because thats absolutely ridiculous. i paid for my leap card he has no right to TAKE it from me.,2022-08-31
Got the worst service today on this…Got the worst service today on this 🤞Never going to use it. They should train driver's good customer service.,2023-08-31
"the  never comes ans i need to go to…the  never comes ans i need to go to work and i am loosing out on money because these busses are so unreliable and they are putting people like mines jobs at risk, please step up the game  eirann your better than this",2023-02-05
Great Customer ServiceMyself & my partner were waiting for over 1 hour for the last  to Fermoy Friday 21st. No  showed up.  A lovely  driver when passing went out of his way to get us home even though he was finished his shift. I think he said his name is Ricardo! Thank you Ricardo &   for your excellent customer service. There was probably 10 people in total not left stranded late at night in the city. Tks Lis,2022-10-21
1 star it's too much for this…1 star it's too much for this ridiculous  company... Over 1 hrs late in a public transport... Fixt the problem ASAP!,2023-07-30
"An absolutely awful serviceAn absolutely awful, awful, AWFUL service !I am lucky that I drive but my wife doesnt and gets regular buses. They regularly don't show up.1 in every 2 times I get the  with her we are left disappointed. Buses are 15 minutes late, early and the driver leaves early, or they never show up.God forbid people would have to be somewhere on time.I'm writing this after we waited an hour in the centre of cork city for the required  to arrive. After a half an hour, we thought we were in luck ; the right  arrived only for the driver to switch off the engine, grab his things and leave. I asked was another driver on the way and he didn't know but said there should be.No one arrived. Oh and as he was leaving, he tried to close the doors with a button but that was broken of course. so he fumbled them 90% closed manually.For the following 20 minutes I played a game which involved spotting 'out of service ' buses driving past.There were 5 or 6 in that period, all seemingly driving around redundantly and of course emitting plenty of carbon, while a group of about 20 of us waited desperately for a .I presume that some of that group were by now late for something important.Eventually, a rogue  arrived, not on time or anything, just at random o clock, and we all rejoiced in relief.It must be amongst the worst public transport set ups in Europe. An absolute shambles and a regular let down.The complaints system is redundant too, a bit like AnPost, mired in 'ticket system ' delays and glitchy UIs.They either don't give a feck or the system allows them to ignore /bury their heads in the sand.Failed state indeed. People should be up in arms about what is such an important service, and even more so now as we try to tackle climate change.",2023-09-11
"Big thank you to driver Seamus on Letterkenny route!Got the  from Letterkenny to Dublin yesterday. We had to change buses in Monaghan and in the rush I left a new coat on the first . The driver, Seamus, couldn't have been nicer when we got to Dublin. He really went above and beyond to help me out - found the coat on the  when he was back in Monaghan and brought it to  Aras today. A real gentleman, made my week!",2023-07-17
 was way way too hotBus was way way too hot it was so stuffy I couldn't breath and driver kept heating on even tho I asked if it could be turned,2022-12-16
Worst serviceWorst service ever taking the  after a long day of school and everyone getting screamed at by the  driver from passage west st Peter's refusing to stop at certain stops aswell wich the  normaly stops at because that's the rou,2022-11-10
Pr*ck of a  driver said  was full…Pr*ck of a  driver said  was full moved on and collected people next stop sh1tty company kys,2023-08-24
Its 2022 and i need cash to pay for my…Its 2022 and i need cash to pay for my trip you dont take card this is a joke probably because   wont pay for the update  ITS 2022 pay for the upd,2022-08-26
Disappointed all time...Disappointed all time...Buses will become late all the time to reach  station..we can't reach our destination at our needed time...👎👎,2022-11-29
"Buses are constantly lateBuses are constantly late. Not 10/20 mins late either, I mean they're 30-60 mins late. I have gotten numerous buses the last few months and every single one was late, not one  was on time. One  I was meant to get at 16:10 from Derry to Letterkenny didn't even show up, so I had to get the next one at 17:15. Absolute joke of a  service.",2022-08-29
"HorribleHorrible, slow service! Not worth depending on for work, school etc they’re the worst transport service in Ireland.",2022-12-11
I have no good experiences with …I have no good experiences with  eirean.  always comes late  or else just doesnt show up atall. Bunch of wasters,2022-10-27
" 30 minutes lateBus 30 minutes late. I called them and the lady was able to confirm that they were running late and she was very friendly. Unfortunately bad  service, but friendly phone service 🤦‍♀️",2023-06-18
"Missed FlightWe were travelling to the  airport to catch a flight to Dusseldorf leaving at 07:05. We waited in Boyle and when the  turned up the driver said it was full with all seats booked. One lady got on as she had a seat booked.We had no other way of getting to the airport so had to go back home...When will   put on a bigger  or more buses so that people are not left behind. There are a lot more people traveling now and especially at Xmas time. It was  01:45 in the morning and  minus 5 Deg.Yes, I know we should have booked seats but Boyle is only the 3rd. StopAfter leaving Sligo so didn't expect the  to be full so early on the route.Just so people are aware not to travel unless you have a seat booked.",2022-12-09
Absolutely disgraceful drivers on the…Absolutely disgraceful drivers on the 115 service in mullingar. I made two complaints and was just ignored. Will  not be using this service again. Had to give 1 star but it's a zero from m,2022-11-20
I take the 220  daily and the drivers can be so rudeI take the 220  daily. A lot of the drivers are very friendly. But I few times I Have gotten very rude drivers last week a driver would not let me on his  as I had a vape and was buying a teen ticket. This was very weird as I have proof of my age which I showed and it his none of his business with what I do with my life. Just a moment ago I was waiting for my  home from work and the  driver pulled up and stopped I waited about 10 seconds as it looked like people we about to get off the . I am not joking when I say she opened the door for 5 seconds and when I didn’t step on (as I was waiting to see would anyone get off) she closed the door in my face shrugged at me and drove off. I’ve also had my fair share of driver just drive right past me with a half full  and this makes me have to rush for work. I will be bringing this forward as it is a very rude and unorganised  company.,2022-08-27
Rude  driverThe  driver was so rude to the passengers.Absolutely horrible how he talked to people.The way to spoke to me about not having a student card on me was a disgrace.There are nicer ways to talk to people.Also about 20 mins late.,2022-12-23
You can't rely on the  in Galway…You can't rely on the  in Galway city. Always late; i have waited an hour for a buses that are suppose to run every 20 minutes. They want peole to take the  but they're so unrealiable; its impossible.,2022-08-09
PoorNo buses. Other people getting trained and they don't have the courtesy to open a door and explain anything about 3 buses going missing. Shambles,2022-09-29
Rude drive 101x 07;37amBus driver so rude to me….was trying to use a leap card for the first time and I didn’t know what to do because I could not see a machine….he just stared at me and didn’t do or say anything…then I thought maybe they didn’t take it on the 101x….eventually he did it for me. I was mortified! It doesn’t cost anything to be nice…,2022-10-21
"The Driver on the Expressway no 30 from…The Driver on the Expressway no 30 from Enniskillen to Dublin departing Enniskillen 18.35 arriving in Dublin 21.35.He has excellent driving skills which I can really appreciate due to  many years of both travelling and driving, He also was very courteous and obliging.",2023-03-31
"The worst thing you can ever experience…The worst thing you can ever experience in your life isn't any type of cancer, it's 39 and 39a buses.",2022-12-13
The  driver didn’t stop at any of…The  driver didn’t stop at any of the stops even when I had a prepaid ticket and didn’t stop when I pressed the stop button so I missed an even I was meant to attend,2023-02-15
"Absolutely appalling serviceAbsolutely appalling service, the 32  from Letterkenny to Dublin is the worst I have ever experienced.Can't the Irish transport system get anything right?",2023-01-18
The  timetableThe  timetable for   is rubbish because the buses are always running late and I had to wait nearly 1 hour for a  and there are always buses out of service. WHAT THE HELL IS THAT ALL ABOUT!!!,2022-10-27
Regular relucant userRegular relucant user. Awful service. Non-existant buses constantly. Really third world stuff.,2023-01-24
"Arrogant.Listen. I’m trying to like the service. I am really am. However the  turns up 15 mins late, it should be at least 15 mins early for an airport pick up.  was roasting, I asked the driver to turn off heat please, to which he said no chance, but he’ll turn it down. Baring in mind it’s 10degrees outside. He’s sitting down there with his wee cup of tea and radio blasting with no regard for his paying customers. THIS IS YOUR JOB FELLA. We’re paying you. I’ll not be from now on.",2023-02-24
