Review,Date Posted
conyaThey are never on time for one and Im here waiting for a  that should be here at 19:50 and it got here at 19:40 and left which is not its scheduled time this  is a crap show,2024-01-02
"Worst transport in IrelandThis  service is a great example of anything made or built by the Irish. Doesn’t work properly, always late, zero information on why these things happen also and completely ignorant of these problems acting as if they never happen. I get the  5 times a week. I get this  anywhere from 9am-5pm to Dublin and anywhere from 5pm-3:30am. Out of the 5 times a week two  rides the  is late 80-90% of the time. The rest of the 10% it doesn’t show up with zero explanation. It’s actually extremely rare that these  services run smoothly I’ve been taking a   service for 3 years every week consistently and never has it been good. I feel sorry for the drivers as they aren’t all bad bar a few. But they have to deal with a poo transport system, poo vehicles, and a poo government that will not update anything but their own pockets. No one but customers will read this. But if someone reads this that has any title to fix these issue how about you get up off your ass and fix something that could be done in a couple of weeks rather than lining your own pockets with the money of poorer less fortunate people.",2024-01-03
"Has to be the worst transport service…Has to be the worst transport service ever! running an hour late.And then after exiting Dublin Airport, which is extremely busy.The driver decides to go for another spin into the airport adding another 30mins at least to the journey.  is a joke of a business.Is it that they want to run this service into the ground, to give reason for a private company to take over?",2023-12-29
"The most unreliable serviceNo only are we unsure if the  will arrive, if it does arrive it's always late and now   are telling drivers to drive by people waiting if the  is late. Not to mention the buses don't go the full intended route as well as some drivers being unnecessarily mean.",2023-12-11
"So uselessSo useless. The  times and schedules are more difficult to predict than the Irish weather! Standing at the 401  stop at Parnell Avenue in Galway, missed 3 scheduled departures because there was no . You'd be quicker walking.",2023-12-09
"  service is the worstBus  service is the worst, it’s the slowest , 2h journey from Wicklow to Dublin and the drivers are mean, impolite and unhelpful. I’m on the  now, I asked the driver to turn off the lights in the  as it’s early in the morning and it’s dark and asked him as well to put the heating, he did none of it, gave out to me and raised his voice on me.",2023-12-08
Cant even get a student ticket in peaceJust drove a 6 oclock  to westport from castlebar i had to take for work i am 16 so usually i take student ticket and when i was 15 child tickets but when i started working i had to go often which meant i had to get student tickets and   is the only  that drives to westport. I got this  all the time from the same  drivers and the more often i started going the ruder they got. I know the  drivers and never got told to bring a student ID until the last few times. 1 of the times the  driver was extremely rude when i bought an online ticket coming back to castlebar he started telling me i am not this age and i need to bring ID and was about to make me wait until the next  then he proceeds to  the ticket into his  and it didnt work. Took a few attempts until he told me that people tend to cancel these tickets like i was trying to scam my way through. I finally got on then today. Something like that happened in the morning before where the  driver was aggressively telling me that i am not a student when ive drove with him so many multiple times before. This morning same thing happened when i got eye rolls even though i accepted the fact straight away that i dont have a student ID on me. He spoke to me like i was some pet like i argued with him for 30 mins about it which i didnt i usually thank the  drivers too he then tried to trick me into buying a single adult ticket when i told him that i need a return ticket like im some cheapscate that doesnt have any money and assumed it sobus  fix up your drivers attitude if i respected them the many times i have driven the buses they should respect me too and yes they wrre playing by the rules but in a very rude unnecessary way,2023-12-27
"Dear God...Dear God, this company is undisputed, absolutely peerless in soul crushingly terrible, utterly indifferent hopelessly incompetent ""service"". This 245 route to Cork is once every hour and they routinely just don't even bother showing up. Waiting 2 HOURS for a  is just plainly mind numbing. I looong for the day I get my car and no longer need this despair in my life. The government really needs to remove their commission for public transport in this country. I could get actual chimpanzees from the zoo to train up and do a better job at running a transport service. A horrifying experience. -245 stars from m",2023-11-15
" Éireann is more of a means of… Éireann is more of a means of testing one's patience than a mode of transportation. Busses cancelled ALL THE TIME. yes the 220 . Today, due at 17:15 didn't arrive until 18:00 and is painfully slow and inefficient. Half the time Midway through the journey I'll be hoofed onto another  with NO EXPLANATION!!!!!!! GET YOUR S*IT TOGETHERRRRRRR",2023-10-27
Drivers drive past you even when the…Drivers drive past you even when the buses are not full,2024-01-06
"High fares for unreliable services101  Service from Dublin to Drogheda has started using smaller capacity single decker  which if you are taking at peak times will be always full unless you are taking it from the  station. The seats are uncomfortable. One of the Fridays, it was raining and I was waiting to take the 101, first of all the app is never correct on timings, the  came 5 mins later than the time shown on the app. It didn't even stop in swords and drove past the  stop. The next  came after 30 mins, which was already full. I managed to get an aisle seat but there is literally no room. I usually keep my bag on the lap, but there was no room to keep it there. It kept falling and the girl beside me was also uncomfortable. Don't understand why they have huge luggage racks up in the front when most commuters like me are daily work/school/college commuters. Literally no one I know uses 101 to go to the airport if they are flying somewhere. Now the 100x is whole another story. Although you can reach city/airport quite quickly if you manage to get on it at peak times, they only have  hourly service with ridiculous fares. 10.50 one way from Drogheda to Dublin Airport, for less than a 25 min ride! You can fly somewhere in Europe for much cheaper for the same amount you spend on Expressway buses. Public transports should be affordable!",2023-11-17
"Just went on the 115  from dublin to…Just went on the 115  from dublin to mullingar from heuston at 18:50  and was welcomed to the  driver having his legs spread at the chair… that’s not all, i was going to maynooth university but had a change a plans and had to get groceries before i went to the uni and tried to leave at the stop beside the train station only to be screamed at and told to sit down and he said if he ever sees me again that he would refuse service to me… atrocious language and behaviour for wanting to get off an earlier stop…. Not only this  has consistently cancelled and delayed buses they also have extremely rude  drivers. I take this  weekly and has never been a problem if i wanted to leave earlier or not. Terrible  company and if there was another faster  i would take that any other day over this terrible ass .",2023-12-04
"  drivers are heartless and recklessBus  drivers are the most wicked human beings on the surface of the earth and on any other planet that has human beings. The buses are so irregular, either they are coming too early or too late. When they are early, they don’t wait for the set time they are supposed to be at any  stop and when you see them just pulling out and you are running and waving them down, they pull out and drive past you in the cold and rain. How heartless can a human being be? This is a constant occurrence on the 101X from Dublin to Drogheda especially at the close of work between 4.30pm and 5.30pm. They rather drive away with an empty  than wait a minute or 2 for the real time to get enough passengers, this is the most cruel behaviour I have seen in my entire life. They don’t deserve any star at all.",2023-11-27
"Worst serviceWorst service, cancels like 2-3 consecutive buses making fools out of people who's standing and then the 4th  obviously would be full and wont stop at the busstop.",2023-12-01
"Service from Ireland West Airport to…Service from Ireland West Airport to Galway was an hour late. Absolutely no shelter or anything to do and a big crowd if people just left without any info , freezing cold.Unfortunately this is not unusual for  . Disgraceful for a national service!!",2023-11-03
"Cancelled  without any replacementJoke of a company, cancelled  last minute without any replacement which completely destroyed our plans as it’s Sunday and there are not many buses running today",2023-11-19
"Oleg Rakuts 109AI want to say a big thank you to one of your driver's Oleg Rakuts on the 109A route. He rang me on Saturday morning to say he found my son's phone. He asked me where we live and when I told him we live in Ratoath he suggested instead of us driving to the depot in Kells, he told us what time he'll be traveling through Ratoath that night on the 109A route so my son was able to meet him at the  stop where he handed the phone back to him safe and sound. What a kind, honest and very helpful member of staff you have. The 109A route is an excellent service and Oleg is a credit to you. Could you forward this message to his manager please? Thanks again Oleg and happy Christmas 🎄🎅",2023-12-09
"Travelled from Cavan to Dublin airport…Travelled from Cavan to Dublin airport today on the 30  and a great experience.   arrived right on time 10.35 from Donegal, has never happened before as always late or dosent turn up. Wonderful driver named Dermot and a great personality   should clone.him.",2023-11-19
"The 216 and 219 buses in Cork City are…The 216 and 219 buses in Cork City are absolutely terrible. They often don’t keep to the timetable and can show up either too early or too late and if they show up late it can be over 30 minutes late!! It’s like they regularly show up whenever they want to. Also, there’s no timetables on either of the  stops I use and no real time info either, so it’s a guess work! Yesterday I was waiting over 20 minutes for the 216 and today over 30 minutes for the 219 in the cold. An appalling and unreliable service. The Irish government should drastically improve the public transport!!",2023-11-15
Ever since they added more stops to the…Ever since they added more stops to the 323 route that never did few years back. It means lot more passages now get 323 and using these new buses are a joke there's less seats now than the old buses. So now there always full most days so some passengers are left behind and have to wait for the next one.   seriously have to re think 323 route because under current format using those new buses it's not working and also 3 hour gap in morns and afternoons that there's no service adds to the problem because it adds to the volume of passengers then on next  after those 3 hours. Where as if we had extra buses in those 3 hours it could help with the amount of passengers then over following services.,2023-10-09
Absolutely terribleAbsolutely terrible. The 343 is the most unreliable chaotic absolutely ridiculous. I can't tell you how many times it literally just did not show up ..Leaving an hour wait which is just not good enough as it is a busy route with many people relying on it to get to work/school etc..If it does manage to show up it is usually late and could have an hour and half journey ahead of you that should be only a half hour cramped next to strangers. Unfortunately I don't drive and so I have to continue to suffer these poor conditions as I have no other choice financially. At 5 months pregnant though I am finding it increasingly difficult to tolerate.,2023-10-11
Damien the lovely  driver from LimerickI was getting a  from Killmallock to Limerick  station today and a really genuine and caring  driver made everyone's day on the . By being chirpy and kind. I know everyone has bad days and they can be in a bad mood. It's understandable given the way the world is. But Damien from Limerick thank you for keeping a lovely smile on your face despite those difficulties. He was also on time and was just a pleasure. Seeing him going that extra mile helping people even after he had got people to the  station.,2023-11-23
101 morning service has become frustrating and unreliableI was at the Balbriggan Garda Station  stop this morning at 6.40am waiting for the 101 service to show up. It didn’t arrive until almost 7.30am and it was so full that it left most passengers stranded. Single decker buses with only about two thirds the capacity of the old coaches are being deployed during peak hours on the 101 service also. These buses don’t have the capacity to take on all the passengers along the route causing people to be regularly stranded. It’s just not good enough.,2023-10-18
"What an ignorant driver on the number 7…What an ignorant driver on the number 7  cork city route from Douglas to Dublin Hill. 4 times I've had a run in with him his customer service skills are appalling. He's the most ignorant man I've ever met, Do better  E",2023-10-10
"Disappointment after disappointmentDisappointment after disappointment, at 30 years old I finally had to buy a car to guarantee I could get to work. You can't rely on the Cork City or county services for anything important, the buses are early, late or just don't show up. The whole thing just needs reforming, it's definitely the worst public transport service I've encountered except for North America where it's non existent. They probably need to travel a bit and get inspired by some other European countries.",2023-08-23
"This is a nightmareBuses are always cancelled. To arrive at the point you should wait approx. 30 minutes. Often it's under the rain. Sometimes drivers just ignores the fact that you are standing on the  stop and drive away!!! It’s very illogical that to go from the center to Ardkeen you can’t take route 354 because it’s a pickup only at this stop!!! Everything has been done to make the buses as inconvenient as possible for users!!! TFI route app is not always correct and you can only lean on the fate and luck to arrive home not after 2 hours after work day tired, exhausted and wet from the rain.People uses this company only because it's monopolist. It there will be some alternative, I would avoid using this...It's about all the   transport in Waterford.",2023-09-23
"The 32 and Monaghan  station are awfulMy  (the 32 from Letterkenny to Dublin) on 5 October 2023, was 35 minutes late at Monaghan  station. As usual, no update was given at Monaghan  station. I honestly have no idea what the staff there actually do. There is a public announcement system but they certainly don’t use it. It’s no better than a  stop.Also, why on Earth are the prices on the  Éireann website and the Expressway website different for the same services?I loathe the dysfunction. Please improve.",2023-10-05
"Incredibly unreliable serviceIncredibly unreliable service, 2 Galway 401 busess in a row simply didn't show up so I'm late for work after 45 min of standing on a  stop. Simply unbelievable how this is a normal occurrence and there's literally nothing you can do. Disgraceful, zero star service.",2023-10-11
"An absolute disgraceDoesn't even deserve one star.  service 202 / 202A, Merchants Quay to Mahon:  constantly cancelled, you could be waiting over an hour at this stop without seeing a  passing (there should be a  every 10 minutes according to   timetables). Nowhere to shelter from the rain as a massive crowd accumulates due to the lack of buses. Shame on you  !!!",2023-07-30
"BAD BUSTHIS SHOULNT EVEN BE DESERVING 1 STAR . THIS  NEVER SHOWED UP I HAVE PLACES TO BE IVE BEEN STANDING FOR AGES AND IT NEVER SHOWED UP . ABSOLUTELY USELESS , THIS  BETTER PATTER UP",2023-11-18
"Busroute 51 is a disaster. route 51 to Galway is either late (sometimes up to 1 hour) or full. I don't understand how you can book a ticket online even when the  is fully booked. Today I see 6 people standing at the  stop in Ardrahan and the  didn't stop. (It said,  full). It's the most unreliable public transport system I ever came accross and it's been like that for ever. I see many negative reviews but they are ignored and nothing is done to improve it. We live in a time where public transport is more important then ever.",2023-09-20
"Worse than a 3rd World companyI've gotten buses in third world countries that are more reliable than this sh@teJust missed out on a job interview because yet again there is no fail safe for late buses/driver no shows, its the typical Irish attitude of 'it'll be fine'How hard could it be to have a second driver and  available in case of an emergency? They simply don't want to pay for it, in a country that's economy that is allegedly booming.As always, never trust an Irish man to run a company efficiently... and I am",2023-09-07
If I could rate it 0/5 I would.The 109  services are disgusting since they are always 20-40 minutes late. They have the rudest pr*cks for drivers who will see you running and leave 5 minutes early because that's how little they care. I've been having to take taxis because they are that unreliable and make me an hour late for work every freaking time and I had enough. I'd rather spend 30€ a day then a penny more for these buses.Disgraceful.,2023-10-06
Punctuality is shockingbig well done to the d1/d2  service to drogheda for consistently being over 10 minutes late every single time🙌🙌🙌 sometimes even thirty,2023-11-09
"Absolutely useless support and websiteAbsolutely useless support and website.I bought a ticket, had to change it, called support, they advised to change it online, the system only let me change only one leg, I changed it and tried to change the second leg, their system didn't allow me do it, called support again, they advised to try again, still not happening, called support,  they asked me to request the refund, I did, got an answer from Gerard, they don't issue refunds to amended tickets. Emailed back, no answer for 2 weeks, called support an requested to speak to a manager, got an email from Gerard the same day, refunds aren't possible in amended tickets... Absolutely useless, the amount of time I have wasted with this company... ridiculous",2023-09-29
"RUDEWhat rude drivers you seem to hire  . 405  driver from Galway cathedral to westside yesterday started slapping on the cabin window because I hadn't fully topped up my leap card on time. I asked how much it was to which he grunted 1.90, obviously I corrected him that it was 1.90 PLEASE!It takes nothing to be proffesional and kind, perhaps if this rude man is dissatisfied working for ye he should find some other line of work.",2023-03-13
"The 32  was 30 mins lateThe 32  from Dublin to Letterkenny at 18:45 left at 19.15. For once people waiting were actually informed of the delay and given an estimated departure time. The  broke down en route to the station. I’m still giving one star because these delays happen virtually every time. Ridiculous that we still pay full price for this. The 32  is always late, particularly arriving at and leaving stations and stops en route. The people of Monaghan and Donegal deserve so much better.",2022-12-13
Worst public transportation EVERI have been in many countries and I came to Cork to study.All my life I have never witnessed such terrible service when it comes to public transportations.After 1 year in Cork I can state that they are ALWAYS LATE. No matter the day or the time. Full buses. I've always been late to work and to class.Probably among the worst public transportation systems in EU. And what is worst is that who's in charge doesn't care.DO NOT rely on buses in Ireland.,2023-10-15
"How is this a service and why do I pay for it?Completely unreliable service, with arrogant and disrespectful drivers. It doesn't run to any schedule and when it finally shows up, its full, smells of urine and when you ring the bell to stop, it ploughs on to whichever  stop he feels like. Avoid like the plague and get yourself an electric scooter or any other mode of transport, a carrot powered snail will be better than this. Also a common occurrence is to see 3-4 buses come at the same time as if its a roller coaster ride.",2022-09-09
Rude DriverVery rude  driver on 101 to Drogheda. Asked if he stops at Swords Pavillion as it was my first time and he ignores me. As we approached the stop I asked him what to do and he ignores me yet again after speaking up. At the stop he says you don’t ever get off at this stop and got fed up over nothing. Told me to f*** off and get off his .,2023-11-20
"  step up your Game!  you should really consider investing some money in new buses, they are old, smelly and they are falling apart. Retrain your driver's on customer service because they are absolutely rude, with their arrogance and short answers!! You need to step up your game!",2023-04-19
"This  company doesn’t even deserve 1…This  company doesn’t even deserve 1 star. The experiences I’ve had with the 355 service is ridiculous. I had a doctors appointment today for my 24 week check up as I am pregnant. The lazy  driver decided not to stop at my stop as it was probably too much hassle for them. Missed my doctors appointment because of this, I also suffer with anxiety and was completely distressed over the whole situation. Also 95% of the drivers I’ve come to meet are pig ignorant.",2023-08-01
"Very bad customer service,not all…Very bad customer service,not all drivers but  a good few and this is enough. Making complain make no sens Customer care stay always on they workers side no matter how bad was they behave .Unbelievable that in 21 century such a company is existing at all .They advertise toilet in  but drivers don't know if it's working or not.Many times just closed",2022-09-12
"Completely incompetent companyCompletely incompetent company. They dont care of their customers, of the reviews. A 6 year old child could manage the company than they do at the moment. Ignorant employees. Buses late all the time 30min, for years. Always the same excuse ""traffic"". Even tho the actual problem is that the buses never leave in the specified time. Somehow there are other companies who drive much further routes and still always make it on time or even earlier. But  ? Never.",2022-10-14
Possibly the worst  service in…Possibly the worst  service in Ireland. Utterly rude drivers with no professionalism or ethics. I got belittled on several occasions while travelling on this  service. Just literally avoid them if you can. They don’t give a shi*e even if you file a complaint.,2023-03-27
"Unkind driverThere is a  driver of 101X who has been rude.. I completely understand for security reasons people have to remain seated until we arrive where we get off, but please, there is a way to talk to people.. :-/ Saying it politely I would have understood as well :( It was embarrassing how he shouted at me.. :( And that driver actually seems to be always in a bad mood (I live in Balbriggan Co.Dublin, and take the  101 or 101X everyday to get to Dublin on my way to work).. Please, if I may, I think there is a difference between giving an advice, and telling someone off.. :(  It's the Busaras'driver  101X I just took in Balbriggan (around 7am), number 231-D-13259.",2023-08-11
"Wexford  depart many locations…Wexford  depart many locations especially in Dublin heading for Wexford earlier than the scheduled time. When I emailed a complaint several times,they lied stating they had checked tracker and  left later than scheduled time . I will not be using them again . Very bad to deal with , no satisfaction nor apology from the company.",2023-05-16
"The worstIf I could give no starts or 5 piles of sh@*te I would. Where to begin...My son started 1st year in school today despite two phone calls no information about pick up point pick up time or . Had to drive around all morning trying to locate the  and end up driving him to school myself. Turns out pick up point is 5km away on the side of the road with no shelter.My daughter tries regularly to take the local  to work. 50% of the time it doesn't stop at our time,  full with no back up  ever supplied. I've witnessed myself drivers shouting at people trying to get on a  to get to work in the morning, telling them  is full, again no back up.This absolute shitshow is supposed to be an alternative to owning a private car......",2023-08-29
"I'd rate them no star'sWorst  company ever especially in dublin airport 100x to dundalk goes every hour and 7.20  driver and came out of said only 12 people allowed on the  was full . People were waiting for ages with family's etc   driver said another  would be here in 20 minutes no sign of it then hour later same thing happened saying you needed a pre book a ticket and people had return tickets etc . Why wasn't there a back up  ? They treat their customers like dirt . Holding people up trying to go home . You's are a absolute disgrace, liar's . No respect for people's time . It would stop me using your  again.",2023-08-06
