Review,Date Posted
"TerribleAbsolutely disgraceful handling of passengers and the most unpleasant and unconforming  transportation organisation. I have been to many countries second world and third world and this one takes the cake for worst service, most unpunctual and least pleasant. Everything about how this company handles itself is troubling and it's very regretful that we have to deal with these buses in Ireland. I really hope everyone lowers their expectations down even lower than low because there is nothing good waiting for you when using this public transportation. Just terrible all around, honestly. The amount of bad experiences I've had in just the last few months that are completely because of the  driver and the company's rules alone. This company should be banned and fined heavily. Just today I was running to the  with everything I had otherwise I will miss my college and I see it just leaving the  stop at Ventry Drive. It stops at the stop sign after driving a whole 6m at most because this road is tiny and I'm there knocking on the door for him to open it. The  driver looks straight at me and shakes his head like I'm asking for a lot here. Just open the door I've after been running to get in this  for 7 mins straight and I'm no runner. Absolutely ridiculous day missed I hate everything about this company. There is one  driver who is also extremely antisocial and I've witnessed his antisocial habits a lot over the year as he drives the 40E sometimes. He consistently starts driving the moment you drop the money in to pay for tickets. You literally don't have the ticket yet and he's driving and you're falling all over the place. Well luckily I don't because I consider myself physically fit but I have actually witnessed a woman going flying into the ground and sobbing crying the whole time she was on the  because of that. He showed no remorse or regret.",2022-11-24
225 in cork always delayed and driver…225 in cork always delayed and driver in early morning are so angrymen ..like you go work they are delayed and missed the schedual ..at the same time very angry face !,2023-06-14
"Just avoid stress and walk.I can't tell you how many times I have been frustrated and annoyed with  . Too many to count. If I could avoid having to use them I would.The main problem is unreliability.Even with electronic notice boards at some stops you can't always be sure if a  is due. Sometimes a  simply fails to arrive and you have to wait another half hour or so for the next one. No explanation for why it was cancelled. Sometimes a driver will decide he wants to finish his shift early and will leave before time. If traffic is bad then all bets are off.Another recurring problem is drivers who seem to want to drive buses but don't like having to pick up or drop off passengers. I just had an argument with a driver who failed to stop at a  stop and accused me of not ringing the bell in time. Yet both myself and an elderly lady both pressed the button well before the stop. He was driving so fast he barely noticed our attempts to get him to stop. No apologies. Nothing.  want passengers to be courteous and respectful to their drivers. Well sorry, it cuts both ways.Also there seems to be no agreed time for how long a  should wait at a stop. Sometimes a driver will barely stop long enough to let you on. At other times you can be waiting twenty minutes for him to leave while he catches up on paperwork or something.The whole system of local city buses is badly designed and run. It is not fit for purpose. We need more trams and light rail networks in our towns and cities, otherwise people will just continue to drive cars, making  travel even worse.Even if it's only one bad experience a week it is enough to put you off for good. If you want to avoid stress just walk.",2022-10-17
Good service but  dirtyGood service with comfortable seats and a good timetable of buses providing essential transport across the country however the  is usually dirty,2023-07-22
"Just an awful unreliable  serviceJust an awful unreliable  service. I'm amazed it has a score of 1.5 out of 5, should be 0.",2023-04-18
"Worst  service everWorst  service ever. Tried to get on a Donegal  at 12.30am that stopped in Cavan, only to be told I wasn't allowed on that  and the  to Cavan would be along shortly. The next  to Cavan was at 6.30am and as the station was closed I had to stand in the rain outsid",2022-08-28
"Dogsh*t serviceDogsh*t service, worst transport service on earth.",2023-10-14
Complete idiot and very ignorant …Complete idiot and very ignorant  driver on Galway to Derry rou,2023-03-04
The listowel to tralee  is always 25…The listowel to tralee  is always 25 minutes late. Today its 40 minutes late awful serv,2022-08-13
"Absolutely worse  service I have…Absolutely worse  service I have ever experienced,  is always hour late,   website also gives out wrong live information.",2023-06-22
Hate  EireannWas going to get the last  from Dublin to Wicklow but it was cancelled!!! Had to sleep on the streets of Dublin. This is not the first time this has happened. Hate the doo doo out of this ,2022-08-25
"Booking and paying a ticket even in…Booking and paying a ticket even in advance doesn't guarantee you to take the , the company does not reimburse you, their drivers and agent are rude agressif and totally unprofessional I was almost slapped buy an agent, no one is on the front desk to face this messy service issues.Buying a ticket means nothing, no control, no customer respect and we are paying their salaries, please organise in group for renting a free taxi or regular but don't ruine your plans especially that suitable days for enjoying this country are rare.Very disappointed and very deceived by this company and days off in cork, and this is absolutely not positive to the tourist friendly uses' politic the country Tries to show, over rated country public services.",2022-08-13
"complete disasterUnfortunately,   is the service we have to deal with in Ireland, the line I use , in particular the 304 in limerick City is a testament to our useless  system at the hands of a nonfunctional transport system , time after time have buses shown up far too late , which as any reasonable person would let off if its 2-5 minutes , but seriously , 10-15 minutes is the usual in University of Limerick and other areas , i am consistently stunned at the lack of care they have for  times , and then showing  arrivals that continue for 20-25 minutes and then disappear off app tracking services or electronic screens at stops, further more I’ve tried to contact their helplines to no avail , as in , the line isn’t up please call back later. If you’re a manager or in an administrative position within bud  , as far as I’m concerned your position is useless. Very disappointing indeed",2023-09-15
Waited 40 minutes outside Apple in Cork…Waited 40 minutes outside Apple in Cork city for a  service (202) that is meant to run every 10 minutes,2022-08-18
The Magic Invisible  ServiceBus non-existent despite being scheduled and stated on the information boards in the station and at the departure bay.,2023-07-15
Today I experienced a horrible…Today I experienced a horrible experience a black  driver behaviour not matched with the country’s reputations he does not down the  for kids buggy and obvious  buggies wheel goes under the  and my child school bags also felt in the walkway so bad situation can’t explain enough hopefully authorities will tak,2023-02-28
Your website is really hard to navigate…Your website is really hard to navigate through. Your buses are never on time and your drivers are rud,2023-01-03
I'm UpsetI'm UpsetI missed my  because the timetable font size was too small to read and I miss read the timetable now i have to wait another 20 minutes for the ,2022-03-13
School buses are a total messSchool buses are a total mess. No communication whatsoever.,2023-09-14
" takes 2hrs to get from… takes 2hrs to get from Dublin to Dundalk, absolutely diabolical, 100X literally says Dundalk on the front of the  and accommodates every town and village except Dundalk, stops in every awkward place there is in drogheda and now takes you out for an extra spin to the countryside where nobody gets off, currently still sitting on the , got it at 20 to 5 in Dublin it is now 20 to 7, will never get this  again, Matthew's or the train for all future trips.",2023-02-05
I started working for this company in…I started working for this company in 1999 and spent a very happy and fulfilling 17 years. Great company to work for.,2022-06-11
61 Galway to Sligo is the most…61 Galway to Sligo is the most depressing thing in my l,2022-09-28
Just get rid of the localsJust get rid of the locals and hire other nationalities - problem solved!,2022-10-16
214  always latebus is always late up to 2 hrs sometimes,2023-09-13
You can't count on them.,2023-12-22
"More than 1 hour waiting  103More than 1 hour waiting  103, ots unbelievabl",2022-12-14
"The worst busses everThe worst busses ever , never coming on time!!!",2023-07-30
W3 Waterford City Dirty and dusty seatsW3 Waterford CitySeats are incredibly dirty.,2023-03-03
 1 hour and 40 minutes latebus 1 hour and 40 minutes late. driver pulls in and reminded me how late he was.. it was good to know.,2022-11-18
Very very very very late by 15 minutes…Very very very very late by 15 minutes not acceptabl,2023-05-24
I love this  it is so fun and I love…I love this  it is so fun and I love myself love from z,2023-06-20
Why does it take so long for a  to…Why does it take so long for a  to arrive. Over 40 minutes late.,2023-05-05
The first  I've taken was 1:30 H…The first  I've taken was 1:30 H late. Hopefully it will be the last too.,2022-08-26
"L busL  and L wifi, wouldn't stop at circle k :(",2022-09-09
 is 2 hours late route 214...,2023-11-24
"Horrible journeyHorrible journey,  was late, expensive considering the government (taxpayer) subsides it so much.",2022-08-26
Tossers !!!!!!!!,2023-12-02
Dreadful transportation company,2023-10-10
"Always lateAlways late, so unreliable!!!!",2022-11-24
POO!TERRIBE!! absolute poop services i was waiting an hour at the  stop for it to come i was supposed to meet tommy and naomi and this poopy  came 1 hour late can’t rely on this 1star i wish i could give less 😠😠😠😡😡😡😡😡WE THEN HAD TO GET ONTO A SEPERATE  TO MAKE US EVEN MORE LATE TO MY VERY IMPORTANT DATE,2022-08-06
The  is so nice to me and great talk…The  is so nice to me and great talk to with me and great service as well and to let they know my have needs and I like men drivers they very nice lads,2022-08-05
Worst  in Ireland by farThe 100x from dundalk to Dublin runs hourly. The  is consistently 20-40 mins late to Drogheda. Sometimes up to an hour late. Haven't seen it on time once.,2022-08-02
WORST  IN IRELAND!!!WORST  IN IRELAND!!!!YOUR  IS NEVER ON TIME AS LISTED ON YOUR SCHEDULE! WE HAVE WORK AND OTHER MAJOR THINGS WE DO ON A DAILY BASIS AND YOUR POOR TIME MANAGEMENT SUCKS REALLY BAD!..YE  COMES AN HOUR LATE! AND WE ARE EXPECTED TO PAY FOR THAT!!! THAT'S A WHOLE LOT OF CRAP...,2022-07-30
"Never on time never count on them…Never on time never count on them ,disaster almost every single day it's like.the  drivers don't know.what time it is also.their real time.app is the most pointless app in the world times are all over the place u might as Well be walking blind",2022-07-26
" inspectors at Dublin AirportMy Daughter and I arrived at the  stop at Dublin airport wanting to travel to Monaghan .We did not realise that we should have booked our tickets on line and would have to potential wait several hours to secure a seat on a . We were very lucky that two inspectors were available at the stop Francis and George they were excellent friendly and professional and reassured us that they would do their best to get us on the next  , which they did. They assisted a lot of passengers who were in the same position as us . It would be wonderful if   was more transparent about the need to pre purchase your tickets as a lot of people were very unsure about the process .Francis and George were fabulous , thank you , Philomena & Sl",2022-07-25
You will never get away with this!You will never get away with this!! Me friend is now homeless thanks to your fraudulent  stop (Paulavone roundabout  stop).,2022-07-17
 NEVER ON TIMEAnd here is my question: If I miss my flight due to your delay ... ARE YOU GONNA PAY ME A NEW FLIGHT OR WHATS THE STORY?,2022-07-11
Never fails to dis,2022-07-08
 driver Derek 100 X RouteI lost my phone in Dublin Airport and it landed on the 100 X  and the  driver Derek got it for me and brought it down to Custom House Quay the following day I would highly recommend this  driver as he went above and beyond for m,2022-07-02
Thank you to the  driver Thomas in…Thank you to the  driver Thomas in Limerick for being so kind. I was with a wheelchair user and we couldn’t get off the  because the ramp was far too steep. He rerouted the  so we could get off. 5 stars for Thomas but   you need to do something about this.,2022-06-30
"DISGUSTINGoverpriced , does not accept Apple pay , everytime it has been late , awful staff they are soooooooo mean >:(the  is leaking from the outside in , i got so soggy ewww . does not do student discount Very inconvenient for a student like me.",2022-06-24
Scandalous with 1 and 30mins for a…Scandalous with 1 and 30mins for a !! A service that ment to go every 30mins,2022-06-16
"Last Friday eveningLast Friday evening,  I had the nicest  driver on the way to the airport. He couldn't do enough for me and directed me in the right direction to the terminal. He was such a nice man. I don't know his name but he is a true credit to the company. 5 star Rating",2022-06-12
Lost PropertyI left a pair of glasses on a  and went into  aras to see if I could get any help. The team were absolutely amazing at getting them back to me ASAP.,2022-06-11
A terrible serviceWas waiting on the No32  from Letterkenny. I had pre booked as I was getting on at Monaghan. The  was meant to leave at 11.20am and it arrived at 12. No explanation at all was given. Monaghan  station is closed and nobody to ask. Also it was raining which didn't help things. I was late for work and I'd say people missed flights. The 11.20  got into Busaras at 2.30pm. A disgraceful service. If I'd any other options I would never use them 😞,2022-06-09
"The worst company everThe worst company ever. I live in Wicklow and usually get 133  to Dublin, many times  just doesn't appear on my stop and it just shows on their website that it's gone. There are really few lovely  drivers, but some of them are bunch of arrogant I better not say what, few times the  driver just didn't want to stop for me to get on the . Awful serv",2022-06-04
"Rude aggressive and clueless  driverI got the 51 cork  on Thursday the 2nd of June at 8.35 there was a woman who was clearly on drugs smoking weed outside the  harassing me asking for clothes of me as I had a suitcase she continued to ask for things off me and I tried to keep calm as I was nervous she would rob me , the inspector tried to refuse her from the  but she came up with a sob story and was let on , as I was on the  from limerick to cork she sat right behind me then beside continued to ask for things she then stared to smoke heroin no smoke alarm went off I was scared at this stage and didn't want to robbed or attacked so I presumed the  driver would smell her smoking heroin or take notice to her harassing me but no not at all when she left the  I rang my boyfriend and I was sobbing on the  telling him she tried to take my handbag at one stage when I arrived at Parnell place cork the  driver shouted at me while I was grabbing all my bags to get off he said leave now get out why are you still on the  get out while I was struggling to carry my bags I will never put a cent towards   again And I will be going further about this bare in mind I'm a 22 year old student and got treated horrible by the  driver and a passang",2022-06-03
"Contempt for their customersContempt for their customers. No customer service in Busáras. Cancel buses without any regard for people or where they need to go etc. Seem to think it's okay to tell you ""sure the next  will be here in 2 hours, what's the problem?""",2022-05-29
 driver on the 208 a Dublin fella… driver on the 208 a Dublin fella was so mean to a girl just so unnecessarily aggressiv,2022-05-26
"Worst  serviceWorst  service , bought a ticket online and it was 54 mins late then when it did arrive it was over booked and I couldn’t get on it was told I would be amended but you can amend it unless it’s a hour before your journey. Not the first time this has happened it’s a joke.",2022-05-24
"KIND DRIVER BUSEIRREAN 133It was Sunday night, May 15, 19:30 pm and I encountered  a very nice driver  of buseiirean 133 from Wicklow  to Dublin. He was so nice to greet  everyone  and also he stopped  to help  a Mother with  2 children  to bring it to the  and off the . He has a kind heart. I wish  everyone  is like this, not only drivers but everyone. It brings  so much good vibes and happiness in everyday life.May God bless him more and may he be safe always.Thank  you for your kindness to all the commuters.",2022-05-15
Useless  never comes on tim,2022-05-14
 service is a disaster 40 mins late… service is a disaster 40 mins late work on your times very bad serv,2022-05-12
"32 BUSThe 32 Letterkenny to Dublin  is never on time when picking up in Monaghan, Castleblaney, Carrickmacross and Ardee. Even if you have a seat booked, you may not be able to get on the . On Wednesday, many people were left in Monaghan because there were not any seats left and they all had been waiting for the  for over 40 minutes. If there isnt enough seats, we have to wait until the next one 2 hours later, no extra  ever appears to be put on. The prices are extortinate, even a student return from Ardee to Monaghan is 20 euro. The toilet facilities of   are also disgraceful in every single  station I have visited.",2022-05-05
Absolutely terrible serviceAbsolutely terrible service. Buses are always at least 10 minutes late sometimes even 40 and if the  isn’t running one day it doesn’t tell you anywhere that it isn’t running had about 10 people waiting on a  that never came at 8 in the morning,2022-05-04
"I wish to leave a review of Frank…I wish to leave a review of Frank Scanlon , driver of a replacement minibus fr   today Belmullet to Ballina 11:35 service. I was leaving home in difficult circumstances & he was the epitome of a gentleman. Just so kind . And he is an absolute credit to  . Very grateful thanks. Please acknowledge him. Most sincerely",2022-05-01
"Rude Driveron 28 April 2022, I took the  115 from Half penny bridge at 15.45 destination Mullingar, already late, understood due to traffic, the driver was driving quite harsh. I had to alight in Maynooth. Sometimes the drivers alight the passengers on the first stop opposite to Glenroyal hotel or Maynooth University. Arrived at Maynooth someone buzzed the Glenroyal Stop, as I was siting at the front seats , I was the first ready to alight, I politely went to ask the Driver if I can get off here. He started being very rude and bullying, that if I have to alight here I should use Dublin  service not  . I said I dont mind getting off at Maynooth University stop, makes no much differrence to me, but he continued being rude and  shouting at me in front all the passengers. He could have replied politely saying no this stop is not to alight but not insulting and tell me which  I should take when the  115 by pass Maynooth and I am not travelling for free.",2022-04-29
Got the 2145 109 from busaras to kellsGot the 2145 109 from busaras to kells. A young overseas student missed her stop as she was asleep and woke in Navan. Our driver brought her to a  stop and advised her where to go to wait for the next  to take her back to her original destination which was 20 mins away. He then phoned his colleague coming in the  in the opposite direction and advised him not to charge her as she had paid already and to make sure she got on his  safely. I was so impressed and proud to see this. Thank you  .,2022-04-21
"8:40pm 8-4-22 No.40  Cork to…8:40pm 8-4-22 No.40  Cork to Waterford. Was on the phone quietly talking, wasn’t saying anything offensive and the  driver came up to me and told me I had to end my phone call as I was a distraction and if I didn’t I had to move to the back of the . Was not happy about this never had a driver insist on ending a call before taking",2022-04-08
"The buses are never on timeThe buses are never on time, service overall is badIf you need to get to work never rely on this company, you could be waiting 30 minutes at least for the  even during daytim",2022-04-05
"Awful experience nearly all  men…Awful experience nearly all  men were rude every-time .I won't lie some are nice, but most are so rude and give out to young teenagers including myself . is never on time ever . Doesn't hurt to be nice it's yhere job !",2022-03-14
"Waited for the NX  for an hourWaited for the NX  for an hour. 3 busses were supposed to leave the  stop in that hour. Seeing as I was waiting at the first stop I seen 2 busses arrive just to find out that both  drivers are taking a break and these busses won't be leaving, while I appreciate that the drivers need breaks a nicer approach to the waiting passengers would be nice. This is happening again and again, it is near impossible to get through to the customer service through the number provided, nobody replies to the complaints logged through email. The real time information is a joke - it showed busses that never arrived departing on time ..... Nobody cares about the complaints they are receiving, nothing changes. The phrase ""timetables are subject to change"" seems to be an excuse for everything.",2022-03-14
Never on timeNever on time. Customer service number not valid,2022-03-14
"Rude  driver, and the service is excellentThis morning I had a really bad experience on a 133x, I always ask the driver to drop me off at the cherrywood crossover, (08/03/2022 @ 08:22 this morning),   buses have been stopping there for years, this driver and another one said they don't stop there. when many years the  had stopped there before. on this occasion, the driver was rude and aggressive to me as a loyal customer. I've used this service for a long time and this is the first bad experience I've ever had. what other drivers had told me if it's a Dublin  stop we stop here?",2022-03-08
"Second negative experience within one…Second negative experience within one week!!! Yesterday the  x30 going from Donegal to Dublin Airport was late for one hour. It arrived same time as our gate was closed so we missed our flight. Had to book another ticket and wait for half a day till the next flight, thanks gosh it was London and we didn't need to wait till next day. So, never trust buseireann's timetable.",2022-03-03
This  service is always late….I’m…This  service is always late….I’m not Irish I am foreign …not everyone likes a cold ….I’m freezing in the  with no heating on and the drive slightly opened the window…he clearly doesn’t seem to feel the cold coming towards the people behind him…Route 32 Dublin airport to letterkenny. was 15 mins late and it shouldn’t considering that it was coming from Dublin City ….we all have our jackets on and on top of that I have a sinus infection too…brilliant…. driver was extremely nice.no complains about this but I have complains about the whole system….Route 32 on 27th of February 5:05pm from th,2022-02-27
What is the point in pretending this is…What is the point in pretending this is a fit for purpose service.,2022-02-25
"Fantastic serviceUsed your service last night after arriving late from UK.It was such a good experience.The  on time, driver very pleasant and helpful. It was great value for money, and it was good to see so many people using the service.Highly recommend.",2022-02-08
"Always overchargingI use a leap card and I noticed that they keep overcharging me by logging their system into a different route number than the one I am on. Extremely dishonest and when another passenger questioned this the driver was rude and argumentative. I contacted customer service for a refund and they alternate between ignoring my emails and saying the money will be refunded without delay and then not doing this, weeks later there is still no sign of my money.",2022-01-31
"It has happend too many times that …It has happend too many times that  just drove past me even tough it was not full, how rude is that! Ignored the waving! Many times doesn't show up even though it's on the schedule! This now was 214, hate this company!!!",2022-01-15
I was waiting on my  for 11:40 on…I was waiting on my  for 11:40 on the 7th of January 2022 and I put my hand out for him to stop and he didn’t stop right at the  stop now I had my and right out so he could clearly see and I got in the  and asked was it going to Wicklow town and he said what does it say on the fu&@  and u was like sorry and he said yeah could of out ur hand out sooner how rude I’m always using the 133 and there’s never a problem this man needs to go to school to learn how to deal with people disgraceful this  was picking me up across the road from loughlinstown hostipal at 11:40 and was the 133  number is LD326 I actually feel inbarrsed the way he talked to me in front of all the passengers,2022-01-07
