Review,Date Posted
For 1  driver on the 245 😎For 1  driver !!Donal o Shea on the 245 out of Watergrasshill yesterday 👍 The Flash!! Arrived on time…swear to god our jaws we’re on the ground! He was so lovely too! Got a return ticket…..and guess what?????? YES 👍 The  arrived at 8pm on the dot and again driven by The Flash so we asked for his name…cos honestly he deserves a review! Most drivers blame the system….so I don’t know what this guy does - but he’s beating the bloody system!!! WHAT A MAN DONAL 😎,2021-12-29
"Incredibly poorI waited an hour and a half for a  that was supposed to come 4 times during that time. Then, the following day, I waited the same amount of time. There is absolutely no point in using Google maps to predict when these buses will come, it is entirely random. It would be great if they could at least let you know that they will be ridiculously late, so that you could plan around that.",2021-12-24
"Left a phone on the last  109 to…Left a phone on the last  109 to Dunshaughlin we were only 2 on the , realised instantly when I got off and made numerous calls and emails, the lost and found were extremely unhelpful, was almost like a TV sketch on joke unhelpfullness. When I got phone back, it was in a wallet case that had clearly been rumbled through and the 50e that was in it had been tak",2021-12-21
"An absolute shower of foolsAn absolute shower of fools, overpriced ESPECIALLY as they are part publicly funded so our taxes pay for their petrol. Either don't show up or are constantly late and they won't fork out for insurance on certain stops so you can't get off the  at a stop that's convenient for you. This rule is also only enforced by d*ckhead drivers - some are sound but it's generally a terrible customer experience.",2021-12-20
"Freezing cold in mid DecemberSitting on  here at the moment from Dublin to Letterkenny...and it's absolutely freezing, and I've a coat, scarf and hat on. Can't understand why the driver hasn't the heating on!",2021-12-18
"Rude driver  was in line wirh my…Rude driver  was in line wirh my friends and was not allowed on because we were laughing in the line, God forbid",2021-12-12
"Late and rude serviceBus late again, service leaving 30 mins later than designated time and workers only advising that it would be 10 mins late. A number of the divers on the Cork limerick/Galway (51)  service incredibly rude. A lot of the drivers could do with a course on customer service. The tone and way the speak to some of the travellers is not exceptable. A serious amount if improvement needed!That being said some drivers are very nice, it's a shame all can't be up to same standard. Really bad reputation for the company. - Regular   user.",2021-12-06
"Lousy service record.Lousy service record.Buses don't show up, connecting buses don't wait for other lines to arrive and the timetables don't match up with different lines.",2021-12-06
" cancelled last minute - nothing newArrived 10 mins early for an express  to Dublin for a flight. Waited 30mins (since often the buses can be late) to find out that the  had been cancelled with no replacement. The next  was not an express so wouldn’t have left enough time to get through security for flight.This isn’t shocking, the   service is unfortunately one of the least reliable transport services across Europe. Leaving this here to ensure others know to have a backup travel option when considering travelling with  .",2021-11-28
"Seat spaces are getting smaller says weekly traveler.Seat spaces are getting smaller. My knees are in bits from the seat in front of me because there isn't enough room for me to sit without my knees being jammed against the seat in front. I'm only 5'9"" so it's not like I'm a monster of a man. Many would consider me short.The toilets are always locked and for literally years I have had to travel for 3+ hours on these busses with no access to a toilet.The Wifi is pretty dodgy too (when it works) and just serves mainly as a data phishing front.I would give them no stars if I could. The cost is too high for the service it provides and more importantly the services it does not provide despite their site advertising as much.The  is regularly late and I have been left up to an hour waiting. Also the front wheel colapsed and nearly came off once while we slid down the road on the belly of the . They did not entertain my request for a refund for nearly killing us all.I once had to offer my ticket to a blind elderly woman because the driver priorised my ticket over her travel pass on a full . Only after I told the driver to give her my ticket and I'd get the next  did he have a change of heart and let her on.",2021-11-27
 was late for 40 min!!!,2021-11-26
The  was 25 minutes late!,2021-11-26
Ducking idiot drivers and time tables…Ducking idiot drivers and time tables it's just sad every day I'm late to work and waiting for  for ducking hour and  should be every 15 min Balincolig to cork,2021-11-15
 drivers here are a bunch of… drivers here are a bunch of junkies. they will leave you wait fornup to 40min and no one is bothered!!! no customer support at all. I would encourage anyone in Ireland to use their own transport as  eirean will let you down BIG TIME!,2021-11-09
"Absolute joke of a companyAbsolute joke of a company! Route 120 is nowhere on their website? What the heck? And to top it of, zero customer support!! What a rip off company! Its still 80% cheaper for me use my car and paid for diesel then use this daylight robbing thieves!Talking about encouraging you to use public transportation!! NOT",2021-11-07
Beyond uselessOnly   can leave you waiting 45mins for a  that comes every 20mins,2021-11-05
"Grand if you haven't a scheduleCurrently on the . The  is over half an hour late. The driver isn't going as fast as he could either. It was on time to begin with but the timetable is not realistic at all. It does not take into account that people may have issues with  passes, booking emails etc these things are slowing the service down and when the driver is slow too it doesn't help. I'm on my way to catch a flight. If the  was running on schedule I would have my been in two hours before my flight. I will be driving from Donegal from now on.Don't be relying on them to get you anywhere on the time it says on the timetable.",2021-11-05
"Worst service i have ever used in my…Worst service i have ever used in my life. Buses constantly late, most drivers (though not all) incredibly rude and i have often been left standing at a  stop with a no show . I rang their customer helpline and they didnt know why the  had not shown. Then i wanted my money back had to post my ticket to them and they eventually rang 3 weeks later to say they never got my ticket even though it was posted to the right address. They are a bloody disgrace of a service and i recommend you find better means of transport like a donkey and cart.",2021-10-28
UPDATE:I refer to my previous review and am very pleased to acknowledge a positive and satisfactory response from  .,2021-10-07
"GestapoLady, 61 years old was kicked in the chest (yes, boot to the chest) by   driver for having her mask underneath her nose when boarding the .She's now in Mercy hospital A&E waiting to see a doctor.What is the world coming to?",2021-10-04
TerribleFirst world price for a third world service. I regrettably used this service for one year when I was attending college and it was horrible to say the least. Students should not be sharing a  with alcoholic scum low life's and dole lifers.,2021-09-27
Very helpful driver on the 111 8am…Very helpful driver on the 111 8am service from Trim this morning. Made our journey very easy.  Really appreciated his help.,2021-09-23
"  is an absolute disgraceBus  is an absolute disgrace, every single day without fail the 343 route is late , today (September 14th 2021) the  was 20 minutes late and it was absolutely lashing rain so I am mow soaked and late for college, the  drivers are so ignorant and rude , the fact this is our national  service is an embarrassm",2021-09-14
Very bad service when  never turns upI was waiting for the 8.15  Sunday 12th September and it never turned up... I ended up being late for work.... tramore service needs to improve as its not the 1st time I have been late for work.. u need more driver's.... Tramore  service needs to  be improved,2021-09-12
I use there service only sometimes but…I use there service only sometimes but every time they late 30 min or more terrible service worst of all!!!!,2021-09-11
"Cork  is uselessReally really bad transportation. The time when a car gets to a point faster than a  means that something is very wrong with the city. In Switzerland when there is even an accident or a major trafic delay, the  always has priority to move along and pass through  specific routes. In cork it is simply unreliable.I understand cities have lots of traffic but the  being late by 25 mins. More than 3 times a week is just unacceptable.Get the roads fixed. More priority lanes and  specific lights to properly control trafic.Take a taxi or rent a bike. The  is just a waste of money and a stress giver.",2021-09-08
FALSE AND MISLEADING TIME TABLEBuses always late and several cancelled when buses are late i have noticed dangerous driving and speeding to make up for lost time   is no longer fit for purpose the sooner the company is wound down and private company formed the better   a laugh and a Irish joke false and misleading time tabl,2021-09-01
There is no greater pleasure for some…There is no greater pleasure for some drivers than running fast behind the back of a passenger who needs another two meters to walk to be at the  stop. Many times. Thank you 🤮🤮🤮205 and 220,2021-08-27
TRALEE TO DINGLE 2pm  CANCELLEDTRALEE to Dingle  at 2 pm always late 20 to 30 minutes later every day misleading time table misleading advertising so what i would say the 2pm  from Tralee to Dingle is no longer availabl,2021-08-24
I was waiting for the  and when I…I was waiting for the  and when I got to get on he was being very rude keep in mind I am 14 and there was loads of seats there was a man knocking on the window hoping ta get on cause to see his son and he ignored him know I am waiting for the next  and I had to get back buy 2 and I have a return ticket now I’m after wasting my time on this company it’s just a joke now I’m left standing in the middle of Waterford with no money for water on this hot day and my phone is gonna die and I have no one to contact this is service is just shocking,2021-08-24
"GarbageGarbage. This is not a service its a joke and a bad one at that. I was left standing in Achill County Mayo despite me being on time there was no sign of the . After a few calls to   I was told he was 10 mins away. More than 30mins later he turns up to inform me that it will be one hour before he can pick me up? What is that all about?! His attitude was also totally unprofessional. So I and two others missed our appointments. If the  drivers can't be arsed turning up why advertise the service?I bought a return ticket which of course I couldn't use as I had to make other arrangements. Money wasted for a non service. Never again, I've been pissed about by  Error for the last time.",2021-08-14
"What’s happened to  ?It’s sad to see this service deteriorate more everytime I come back to visit Ireland. I tried using your services to get to Blarney and Kinsale, I was trying to show a friend from Brazil around but embarrassingly enough I couldn’t rely on the National  service and buses either didn’t show up or service  stops had been altered but no information was given. For a National  company it’s really sad that it’s so completely unprofessional and lacking in so many ways.",2021-08-12
So gratefulI slept tough alarm clock and was running late and couldn't get nx  express to Dublin. I got on 109 which takes ages gose though all other towns would definitely be late. Asked the driver of 109 how long it takes to Dublin with 109 that I missed Nx and just got on but he actually stopped after few stoppes and stopped nx that was coming our way and said get on he will get you to work on time. Was my first week in new job didn't wanna be late so grateful. So kind when was my bad thank you.,2021-08-12
"The website is  inefficientThe website is  inefficient, unreliable and time consuming.",2021-08-10
"Still waitingBeen waiting at a local local route  station in Clonmel. I have been here since 4pm, the  was due to depart at 4:15,  never arrived and now i have to wait until the 645 .Thank you so so so much   for justifying my dislike of the company and reminding me of why i hate paying ever more overpriced fares for a service that just gets worse and worse.",2021-08-09
"always late, doesnt stop, rude drivers.absoultely awful. not only these buses are late everytime, they often dont stop even when there are people waiting at the  stop.there has been many occasions where i have been left stranded on  stops  for hours, or have been late to work after waiting for 40 minutes on a  that doesnt come.the drivers are also very rude. i have also had many horrible experiences of   drivers making sexual comments about me, knowing i have a student leap card.if you are planning a trip, please order a taxi or take a Mathews . save yourself the trouble of being late, or being harassed by these sick drivers.",2021-08-06
" consistently leaves  stop up to 20 minutes late or early. Have to wait up to 40 minutes every time.I take the 241 in East Cork every morning and afternoon to and from work. This  is never on time, it has left 20 minutes early and 20 minutes late on many occasions, leading me to consistently have to wait at the  stop for up to 40 minutes. This morning I arrived for the  17 minutes early and waited 35 minutes only to realise that it had left before I arrived and I couldn’t go to work. I don’t understand why these drivers find it so difficult to stay even 10 minutes within the schedule at the very least.",2021-07-21
Left female friend stranded in cork…Left female friend stranded in cork city  Sunday 22 miles from. Her home with the 233 been cancelled on the 18th of July,2021-07-18
"Driver on his break an excuse for leaving lateLike many people who review  Éireann through this forum, I am not satisfied. I do often wonder how you manage to keep the staff you have and recruit new staff. No wonder there have been driver shortage issues in recents weeks and months in Waterford City.On my most recent journey, the route 40  was 14 minutes late leaving Waterford  Station due to the driver being on his break at that time. This shouldn’t happen and if it does the timetables should be changed to accommodate same, or else change the driver rosters. Luckily he told us that it was his break time, most of the time they leave the  full of passengers waiting with zero explanation of why we are not leaving on time when everyone has boarded, as was the case last week.To future readers of this and current/future passengers of  Éireann, I would recommend using an alternative company such as Dublin Coach where possible as their buses are more comfortable, cleaner, MORE RELIABLE, and the drivers are rarely rude and are able to successfully communicate with people.",2021-07-10
I'm not stopping for you!The 202A  from Knocknaheeney on June 27 arrived at the Wolfe Tone St  stop at 2.30 with a  Full sign up. I was the only person at the stop and as it passed I counted at least 2 empty seats! The  pulled in about 20 yards beyond the stop and left 2 people off and pulled away immediately before I got the chance to get there. Is this   policy? How can you expect people to respect  staff when this type of behaviour is tolerated. I expect I'm wasting my time with this review as there seems to be no accountability.,2021-06-27
Lost WalletThe inspector in Parnell Place was very helpful at retrieving my lost wallet. Only took 20 minutes to track it down and was returned within an hour.,2021-06-16
"Can't be relied onI've been relying on this  service for 4 days and they've already f*cked my schedule sideways. I could go on forever with complaints. Ive been waiting for a certain  for 2 days as it says it everywhere on their timetables and I was never informed that it was cancelled, even when asking about the schedule. When sitting at their  stations you'll get multiple ppl asking if you've seen their . I've also noticed that people have been getting rejected for not having change or having a ticket, which is unbelievably pathetic, you cant reject a passenger and get p*ssed off at them because they don't know how to work your machines or because YOU don't have change, leaving them stranded with nowhere to go. Oh, and fix your wonky machines because they keep trying to charge everyone twice as much for a return ticket. I could go on with many other complaints but I think it's already well known across all Ireland that this  service is A$$.",2021-06-12
" says out of service on front...Standing at the  stop at heuston Station today waiting for the 115. My  ticket is paid for already and  is due to arrive at 9.43 to go to mullingar. A  drives by that says ""out of service"" on the front and then on the back its says as it drives by it says 115.  How the hell are you supposed to use a  service that can't even put the number on the front of the  ??!! This is the second time this has happened to me. Pure Incompetence. Rarely on time and usually dirty buses as well. Stay well away and use a different  service!!",2021-06-10
"Rude DriverHiI just want to inform you the  driver on the 17.00 to Donegal  is rude to customers. I will not pay again to travel with  Éireann again.There was a delay with the ticket checking before I even arrived. And he was aggressive towards me because my boyfriend went to the toilet shouting at me saying it was my fault we were late. He shouted at me that the ticket was already used, it wasn't!!!!!! I'm not a liar maybe you should learn to use your ticket machines.Then became I had a shopping bag shouted again aggressively to put it under in the luggage truck.If there is anything stolen or missing I expect  Éireann to reimburse me.No wonder you have to cut services when you give customer service like this.Not a happy customer.",2021-06-05
"Very rude  driversBus drivers are really rude and get agitated by everything for no reason.Terrible service, they cut routes alot without informing passengers too.",2021-06-01
"The worst  service in all of Europe.The worst  service in all of Europe.-Rude, arrogant, unhelpful drivers-unreliable buses, sometimes early, very often very late. Sometimes they don't show up at all !-overpriced-dirty",2021-05-25
Great way to get aroundGreat way to get around Ireland,2021-05-24
"Just an overall poor and unreliable…Just an overall poor and unreliable service. Not to mention routes being constantly cut, most recently the route 51 times.",2021-05-22
"Terrible driverI took the  from william street, limerick city on 19th of may at 8.50pm, while making payment with my  card, my card fell into the side of the barricade and when i asked the driver if he could help me get the card he said it’s not possible that theres nothing he can do about it and the card is gone. He went on to say i was blocking the queue and i should move to the side, he was not helpful to me at all and he was also very rude, knowing fully well my card just fell where i could not reach it. Thankful for the kind people behind me who helped me get the card out. Very terrible service from the driver, absolutely appalling. Terrible service, people should not be treated this way.",2021-05-19
"Me and my partner waited for a busMe and my partner waited for a , that like an obese porn-addicted 50 year old man, never came. The  due afterwards also failed to arrive and my disappointment was immeasurable and my day was most certainly ruined.",2021-05-14
"Extremely unreliableHonestly, giving this  company one star is being extremely generous at this point.",2021-05-07
"The  driver pulled away without…The  driver pulled away without letting a single person on, we booked our tickets. Very upset and saddened",2021-04-29
"Most unreliable  service possibleMost unreliable  service possible. Terrible website, I’ve complained to them many times when I ended up stranded in a random town in Ireland trying to get to another one, only to be told that the  I was waiting for is not running anymore, even though there isn’t not mention of this on their journey planner website. Utter nonsense, that’s this has been going on for years without change.",2021-04-25
"The worst company everThe worst company ever, unreliabl",2021-04-24
"Absolutely terrible joke of a …Absolutely terrible joke of a  company  , I walked over an hour for my  wile I arrived just on time my  drove striaght past me I was in the middle of the road waving at the  he never stopped I then ran as fast as I could to the next  stop I'm the middle of the road the  passed me again... absolutely useless there was anybody on the  it was empty,  105 from blanch to drogheda at 10:24 white haired old driver must be blind deaf and a bit on the stupid side should have had glasses,  I have rang and complained about this wile the customer service was no good she just said ye ye ye ye on the phone and agreed with me untill I stopped talking told me to wait another hour for a  even though one drove by me less then 60 seconds ago, serious time waisters I'll not rely on   again for a  that will problly drive right past me again, I don't use buses often but now I see why people throw up such a fuss over them useless share of sausage pullers stranded now 3 hours waiting it's a JOKE !!!! If the next  drives by me it'll be on cctv",2021-04-19
"Terrible terrible terrible companyTerrible terrible terrible company. If I had an alternative choice I’d take it but I don’t so I’m forced to use their ridiculously terrible services.Buses are notoriously late, it’s just normal at this stage, too often they don’t show up at all - no warning, no heads up - just simply no .Buses are repeatedly full during peak times. The company doesn’t bother sending an extra  despite it being listed on the timetable and despite them knowing there’s loads of people travelling for work. If you don’t get on, tough luck, wait another hour, or two to get the next  home. (Yes I’ve waited two hours for their  before).No  stops in more rural areas just just have to wait and hope you’re in the right place.But honestly the worst of the worst is their online ticketing system. It’s so buggy that several times I’ve tried getting a ticket it either didn’t work or it took my money and didn’t give me a ticket or order number in return.Biggest shtshow of a public transport I've ever seen.",2021-04-08
"I went aboard the 1:30 pm  from…I went aboard the 1:30 pm  from Clonmel to Limerick, I had a  pass and I laid it on the machine, I have a habit of saying where I was going since I have to be used to that for a long time. The  driver had an attitude ""you have a pass you can travel anywhere, don't say where you going"" with a snotty tone and was scanning me up and down as if I had two heads, I felt embarrassed and very uncomfortable, I never experienced that with any other  driver. He was very ignorant and not one bit polite. This is not the first time. I've had a very bad experience with  . To make the situation worse the  driver had no mask either.",2021-04-02
"HorrorSaying i had terrible experience with this company would be like saying nothing.My car broke down so I booked ticket online, line 32, omagh - dublin airport, I came about 15 minutes early just in case. Of course the  arrived about 10mins late, but the best part is what happened next. I started walking toward the  but the driver just drove out the  depot without stopping or even slowing down, pretending not to see me! I chased after him but not much you can do against the  with 2 travel bags. Used my phone torch to attract divers attention but they just kept going. No way they couldn't see me waiting as I was the only person there (it was 2.45am). So I was left alone in the middle of the night, with my bags, without any idea how to make it on time to the airport. I had no other option but drive my faulty car which barely made the trip. Not only I was forced to pay for car park but I will also have to pay someone to get my ride out of there as its completely undriveable now. I wrote a complaint which has not been answered, only got an automatic email ""how did we do?"" asking how my complaint was handled (?!) Absolute disgrace, no apology no nothing, they didnt even offer refund. Its a scandal which Im not going just to leave like that.I strongly disadvise using their service, its a mistake im not going to commit myself ever again.",2021-03-06
"This company couldn’t give a damnBus arrived 30 minutes late, didn’t show any sign that it was at max capacity. In fact, it didn’t even stop. It drove straight past us without warning. We waited for that  for over an hour in the dark and freezing cold. There was supposed to be another  after that one but I waited another 40 minutes and it never came.I’ve been using  services for 7 years and I always feel anxious about taking   to anywhere, as they are never on time or they just never arrive. It’s become a staple of theirs. Any regular  passenger will agree.As a company that has been continuously bombarded with shockingly low ratings and bad reviews for years, I have been expecting improvement for a long time. I can’t wait for the day that I get a driver’s license so that I can stop relying on this entirely unreliable transportation.",2021-02-20
